{"$schema":"https://json-schema.org/draft/2020-12/schema","$id":"urn:ai-governance:schema:antipattern:2.1.0","type":"object","required":["schema_version","id","version","release_status","approval_record","domain","domain_title","object_type","title","canonical_definition","applicability","primary_questions","required_evidence","evidence_rules","hard_gate_effect","normative_source_mappings","finding_definitions","candidate_tactic_refs","runtime_decision_boundary","related_criteria","failure_mechanism","atomic_tests","absence_test_contract","target_assurance_by_lifecycle_stage"],"properties":{"schema_version":{"$ref":"urn:ai-governance:schema:shared-definitions:2.1.0#/$defs/semver"},"id":{"$ref":"urn:ai-governance:schema:shared-definitions:2.1.0#/$defs/antipatternId"},"version":{"$ref":"urn:ai-governance:schema:shared-definitions:2.1.0#/$defs/semver"},"release_status":{"$ref":"urn:ai-governance:schema:shared-definitions:2.1.0#/$defs/releaseStatus"},"approval_record":{"$ref":"urn:ai-governance:schema:shared-definitions:2.1.0#/$defs/approvalRecord"},"domain":{"$ref":"urn:ai-governance:schema:shared-definitions:2.1.0#/$defs/domain"},"domain_title":{"type":"string","minLength":1},"object_type":{"const":"ANTIPATTERN"},"title":{"type":"string","minLength":1},"canonical_definition":{"type":"string","minLength":20},"applicability":{"$ref":"urn:ai-governance:schema:shared-definitions:2.1.0#/$defs/applicability"},"primary_questions":{"type":"array","minItems":3,"maxItems":3,"prefixItems":[{"allOf":[{"$ref":"urn:ai-governance:schema:shared-definitions:2.1.0#/$defs/question"},{"properties":{"dimension":{"const":"DEFINITION_AND_INTENT"}}}]},{"allOf":[{"$ref":"urn:ai-governance:schema:shared-definitions:2.1.0#/$defs/question"},{"properties":{"dimension":{"const":"IMPLEMENTATION_AND_OPERATION"}}}]},{"allOf":[{"$ref":"urn:ai-governance:schema:shared-definitions:2.1.0#/$defs/question"},{"properties":{"dimension":{"const":"EVIDENCE_AND_EFFECTIVENESS"}}}]}],"items":false},"required_evidence":{"type":"array","minItems":1,"items":{"$ref":"urn:ai-governance:schema:shared-definitions:2.1.0#/$defs/evidenceRequirement"}},"evidence_rules":{"$ref":"urn:ai-governance:schema:shared-definitions:2.1.0#/$defs/evidenceRules"},"hard_gate_effect":{"type":"object","required":["effect","conditions","override_authority"],"properties":{"effect":{"enum":["NONE","WARN","BLOCK","CONSTRAIN"]},"conditions":{"type":"array","items":{"type":"string"}},"override_authority":{"type":["string","null"]}},"additionalProperties":false},"normative_source_mappings":{"type":"array","items":{"$ref":"urn:ai-governance:schema:shared-definitions:2.1.0#/$defs/sourceMapping"}},"finding_definitions":{"type":"array","minItems":1,"items":{"$ref":"urn:ai-governance:schema:shared-definitions:2.1.0#/$defs/finding"}},"candidate_tactic_refs":{"type":"array","items":{"$ref":"urn:ai-governance:schema:shared-definitions:2.1.0#/$defs/tacticRef"}},"runtime_decision_boundary":{"$ref":"urn:ai-governance:schema:shared-definitions:2.1.0#/$defs/runtimeBoundary"},"related_criteria":{"type":"array","items":{"type":"string","pattern":"^(AP-)?[A-F][1-5]$"},"uniqueItems":true},"failure_mechanism":{"type":"string","minLength":10},"atomic_tests":{"type":"array","minItems":1,"items":{"type":"object","required":["id","question_id","test","required_evidence_ids","minimum_technical_assurance","required_human_assurance"],"properties":{"id":{"type":"string","pattern":"^AP-[A-F][1-5]-AT-[0-9]{3}$"},"question_id":{"type":"string","pattern":"^AP-[A-F][1-5]-Q[1-3]$"},"test":{"type":"string","minLength":10},"required_evidence_ids":{"type":"array","minItems":1,"uniqueItems":true,"items":{"type":"string","pattern":"^EVD-AP-[A-F][1-5]-[0-9]{3}$"}},"minimum_technical_assurance":{"$ref":"urn:ai-governance:schema:shared-definitions:2.1.0#/$defs/technicalAssurance"},"required_human_assurance":{"$ref":"urn:ai-governance:schema:shared-definitions:2.1.0#/$defs/humanAssurance"}},"additionalProperties":false}},"absence_test_contract":{"type":"object","required":["scope_defined","executed","successful","current","independently_verified","required_artifacts"],"properties":{"scope_defined":{"const":true},"executed":{"const":true},"successful":{"const":true},"current":{"const":true},"independently_verified":{"const":true},"required_artifacts":{"type":"array","minItems":1,"items":{"type":"string"}}},"additionalProperties":false},"target_assurance_by_lifecycle_stage":{"type":"array","minItems":1,"items":{"type":"object","required":["lifecycle_stage","minimum_technical_assurance","required_human_assurance"],"properties":{"lifecycle_stage":{"$ref":"urn:ai-governance:schema:shared-definitions:2.1.0#/$defs/lifecycleStage"},"minimum_technical_assurance":{"$ref":"urn:ai-governance:schema:shared-definitions:2.1.0#/$defs/technicalAssurance"},"required_human_assurance":{"$ref":"urn:ai-governance:schema:shared-definitions:2.1.0#/$defs/humanAssurance"}},"additionalProperties":false}}},"additionalProperties":false,"allOf":[{"if":{"properties":{"release_status":{"enum":["APPROVED","FROZEN"]}}},"then":{"required":["approval_record"]}}]}
