{
  "schema_version": "2.0.0",
  "id": "AP-A1",
  "version": "1.0.0",
  "release_status": "APPROVED",
  "approval_record": {
    "approval_status": "APPROVED",
    "approval_scope": "AP-A1_ANTIPATTERN_CONTENT_AND_PRODUCTION_USE",
    "approved_by_role": "AI_GOVERNANCE_OWNER",
    "approved_on": "2026-08-02",
    "effective_from": "2026-08-02",
    "review_due_on": "2027-08-02",
    "release_version": "1.0.0",
    "supersedes": null,
    "authority_statement": "Approved governance knowledge for immediate production use within the defined authority boundary. Legal interpretation, evidence adjudication, finding lock, residual-risk acceptance and lifecycle authorization remain attributable human decisions.",
    "change_control": "Any semantic, state, gate, finding, source-applicability or tactic-mapping change requires a new version, dependency update, reciprocal validation and renewed approval."
  },
  "domain": "A",
  "domain_title": "Purpose, value, context, roles and classification",
  "object_type": "ANTIPATTERN",
  "title": "Undefined or elastic intended purpose",
  "canonical_definition": "The system purpose is vague, technically framed, inconsistent or capable of expanding through features, users, data, workflows or decisions without explicit requalification and authorization.",
  "applicability": {
    "statement": "Applicable wherever an AI system or AI-enabled function has a declared or implied purpose, including experiments, internal tools, externally supplied systems and general-purpose components used in a specific context.",
    "conditions": [
      "Assess both written purpose and reachable use.",
      "Test scope expansion across lifecycle changes and operational practice.",
      "Include indirect affected persons and downstream decision uses."
    ],
    "exclusions": [
      "Not applicable only when the component has no independent use context and its boundaries are fully assessed within a parent system."
    ],
    "reassessment_triggers": [
      "New purpose statement or product positioning",
      "New audience, feature, data source, integration or decision role",
      "Pilot-to-production or internal-to-external transition",
      "Observed off-label or prohibited use",
      "Organizational transfer or provider change"
    ]
  },
  "primary_questions": [
    {
      "id": "AP-A1-Q1",
      "dimension": "DEFINITION_AND_INTENT",
      "question": "Is the purpose vague, technically framed, conflicting or missing material users, affected persons, uses or decision boundaries?"
    },
    {
      "id": "AP-A1-Q2",
      "dimension": "IMPLEMENTATION_AND_OPERATION",
      "question": "Can workflows, access, data, features, tools or product behavior enable broader or different use than the approved purpose?"
    },
    {
      "id": "AP-A1-Q3",
      "dimension": "EVIDENCE_AND_EFFECTIVENESS",
      "question": "Does evidence show unauthorized scope expansion, or does a current scoped test establish the anti-pattern is absent?"
    }
  ],
  "required_evidence": [
    {
      "id": "EVD-AP-A1-001",
      "title": "Purpose statement corpus and inconsistency analysis",
      "claim_supported": "The system purpose is vague, technically framed, conflicting or materially incomplete.",
      "evidence_class": "DOCUMENT",
      "minimum_technical_assurance": "DECLARED",
      "required_human_assurance": "HUMAN_VALIDATED",
      "acceptance_conditions": [
        "Collects current authoritative purpose statements across registration, product, contract, design and operational records.",
        "Identifies contradictions, undefined terms and missing decision context."
      ],
      "limitations": [
        "A wording difference is not a finding unless it changes material scope or authority."
      ]
    },
    {
      "id": "EVD-AP-A1-002",
      "title": "Reachable-use and audience comparison",
      "claim_supported": "Reachable users, functions or effects exceed the declared purpose or omit affected-person boundaries.",
      "evidence_class": "IMPLEMENTATION",
      "minimum_technical_assurance": "IMPLEMENTED",
      "required_human_assurance": "PENDING",
      "acceptance_conditions": [
        "Compares interfaces, access, features, integrations and workflows with declared users and uses.",
        "Includes administrative, fallback and indirect-use paths."
      ],
      "limitations": [
        "A technically possible but inaccessible function is not automatically reachable use."
      ]
    },
    {
      "id": "EVD-AP-A1-003",
      "title": "Permitted/prohibited-use enforceability test",
      "claim_supported": "Declared boundaries are too generic or unenforced to distinguish allowed, disallowed and misuse conditions.",
      "evidence_class": "TEST_RESULT",
      "minimum_technical_assurance": "TESTED",
      "required_human_assurance": "HUMAN_VALIDATED",
      "acceptance_conditions": [
        "Executes representative boundary and misuse cases.",
        "Records expected and actual control behavior for the current system version."
      ],
      "limitations": [
        "A policy review without executed tests cannot establish tested absence."
      ]
    },
    {
      "id": "EVD-AP-A1-004",
      "title": "Purpose-change and scope-expansion history",
      "claim_supported": "Prototype, feature, audience, data or decision scope expanded without requalification.",
      "evidence_class": "OPERATIONAL_RECORD",
      "minimum_technical_assurance": "OPERATIONALLY_OBSERVED",
      "required_human_assurance": "HUMAN_VALIDATED",
      "acceptance_conditions": [
        "Traces material changes to impact analysis, reassessment and authorization records.",
        "Identifies continued use before or without the required decision."
      ],
      "limitations": [
        "Normal maintenance inside an already approved boundary is not scope expansion."
      ]
    },
    {
      "id": "EVD-AP-A1-005",
      "title": "Affected-person and downstream-impact review",
      "claim_supported": "Material affected persons or downstream uses are absent from the purpose boundary.",
      "evidence_class": "HUMAN_DECISION",
      "minimum_technical_assurance": "DECLARED",
      "required_human_assurance": "HUMAN_VALIDATED",
      "acceptance_conditions": [
        "Uses accountable domain, legal, risk and affected-person expertise.",
        "Records exclusions and uncertainties explicitly."
      ],
      "limitations": [
        "A generic impact assessment not tied to the assessed system cannot resolve this claim."
      ]
    },
    {
      "id": "EVD-AP-A1-006",
      "title": "Scoped absence-test package",
      "claim_supported": "A current, executed and independently reviewed test covers all material AP-A1 failure mechanisms.",
      "evidence_class": "TEST_RESULT",
      "minimum_technical_assurance": "TESTED",
      "required_human_assurance": "HUMAN_VALIDATED",
      "acceptance_conditions": [
        "Covers vague purpose, conflicting statements, missing users/affected persons, unenforced use boundaries and unauthorized scope expansion.",
        "Identifies system version, scope, test cases, results, residual limitations and independent reviewer."
      ],
      "limitations": [
        "Silence, missing incidents, document presence or unsuccessful discovery is never TESTED_ABSENT."
      ]
    }
  ],
  "evidence_rules": {
    "evidence_ceilings": [
      "Document inconsistency can establish a declaration gap but not the complete reachable-use surface.",
      "Implementation comparison can establish reachable divergence but not frequency or operational consequence.",
      "Operational history can establish observed scope expansion only for covered periods and change records.",
      "TESTED_ABSENT requires the complete absence-test contract; no lower assurance state can be interpreted as absence."
    ],
    "false_positive_guards": [
      "Do not treat concise wording as vague when the controlled definitions and linked boundaries are precise.",
      "Do not treat a general-purpose model as an undefined-purpose system when the deployed use is system-specifically bounded.",
      "Do not treat every feature change as scope expansion; test whether users, decisions, data, effects or risk materially changed.",
      "Do not infer a missing affected-person boundary solely from absence of direct end users."
    ],
    "prohibited_inferences": [
      "Do not infer absence from no reported misuse, no complaint, no incident or no detected contradiction.",
      "Do not infer an approved scope change from release, backlog, technical enablement or stakeholder demand.",
      "Do not infer legal non-compliance solely from AP-A1 presence.",
      "Do not infer a broad purpose is acceptable because the underlying model is marketed as general-purpose."
    ],
    "contradiction_handling": [
      "Conflicting authoritative statements establish at least UNKNOWN and may support presence when the conflict changes material scope.",
      "Where declared and reachable use conflict, preserve both evidence paths and assess the broader reachable boundary.",
      "Human adjudication is required where business, legal and technical authorities disagree about the operative purpose."
    ],
    "freshness_rules": [
      "Use the current production, pilot or evaluation version and current authoritative statements.",
      "Repeat absence testing after any material change.",
      "Operational and change records must cover the period in which the alleged expansion could have occurred."
    ]
  },
  "hard_gate_effect": {
    "effect": "BLOCK",
    "conditions": [
      "Block consequential deployment when the anti-pattern is confirmed or materially present.",
      "Constrain operation to an evidenced narrow scope when purpose or reachable-use boundaries remain UNKNOWN.",
      "Block material expansion when requalification or authorization is missing."
    ],